{
  "schemaVersion": 1,
  "id": "MAT_GRAVEL",
  "displayNameKey": "material.gravel",
  "family": "Gravel",
  "hardnessClass": "Hard",
  "hardnessValue": 0.67,
  "densityKgPerM3": 1900,
  "diggable": true,
  "permittedDepthLayers": [
    2,
    3
  ],
  "terrainTags": [
    "GRAVEL_RICH"
  ],
  "notes": "Example gravel material fixture."
}
